{
  "schemaVersion": "1.0.0",
  "decisionId": "fid-18bda8f67bfa",
  "version": 1,
  "projectId": "pilot-sky-blue-canonical",
  "contentMode": "everyday-physics-explainer",
  "contentClass": "FACTUAL",
  "sourceScriptRef": {
    "artifact": "script.json",
    "version": "1.0.0"
  },
  "humanizationRef": "hum-f3ab56c75605",
  "checks": [
    {
      "checkId": "S1:NUMBER",
      "segmentId": "S1",
      "protectedItemType": "NUMBER",
      "sourceValue": null,
      "candidateValue": null,
      "status": "PRESERVED",
      "reason": null,
      "evidenceRef": null
    },
    {
      "checkId": "S1:DATE",
      "segmentId": "S1",
      "protectedItemType": "DATE",
      "sourceValue": null,
      "candidateValue": null,
      "status": "PRESERVED",
      "reason": null,
      "evidenceRef": null
    },
    {
      "checkId": "S1:QUOTE",
      "segmentId": "S1",
      "protectedItemType": "QUOTE",
      "sourceValue": null,
      "candidateValue": null,
      "status": "PRESERVED",
      "reason": null,
      "evidenceRef": null
    },
    {
      "checkId": "S1:NAME",
      "segmentId": "S1",
      "protectedItemType": "NAME",
      "sourceValue": null,
      "candidateValue": null,
      "status": "NOT_APPLICABLE",
      "reason": null,
      "evidenceRef": null
    },
    {
      "checkId": "S1:CAVEAT",
      "segmentId": "S1",
      "protectedItemType": "CAVEAT",
      "sourceValue": null,
      "candidateValue": null,
      "status": "PRESERVED",
      "reason": null,
      "evidenceRef": null
    },
    {
      "checkId": "S1:UNCERTAINTY",
      "segmentId": "S1",
      "protectedItemType": "UNCERTAINTY",
      "sourceValue": null,
      "candidateValue": null,
      "status": "PRESERVED",
      "reason": null,
      "evidenceRef": null
    },
    {
      "checkId": "S1:CLASSIFICATION",
      "segmentId": "S1",
      "protectedItemType": "CLASSIFICATION",
      "sourceValue": "FACTUAL",
      "candidateValue": "FACTUAL",
      "status": "PRESERVED",
      "reason": null,
      "evidenceRef": null
    },
    {
      "checkId": "S1:EVIDENCE:C1",
      "segmentId": "S1",
      "protectedItemType": "FACT",
      "sourceValue": "C1",
      "candidateValue": "C1",
      "status": "PRESERVED",
      "reason": null,
      "evidenceRef": "research/research-brief.json#claims.C1"
    },
    {
      "checkId": "S2:NUMBER",
      "segmentId": "S2",
      "protectedItemType": "NUMBER",
      "sourceValue": null,
      "candidateValue": null,
      "status": "PRESERVED",
      "reason": null,
      "evidenceRef": null
    },
    {
      "checkId": "S2:DATE",
      "segmentId": "S2",
      "protectedItemType": "DATE",
      "sourceValue": null,
      "candidateValue": null,
      "status": "PRESERVED",
      "reason": null,
      "evidenceRef": null
    },
    {
      "checkId": "S2:QUOTE",
      "segmentId": "S2",
      "protectedItemType": "QUOTE",
      "sourceValue": null,
      "candidateValue": null,
      "status": "PRESERVED",
      "reason": null,
      "evidenceRef": null
    },
    {
      "checkId": "S2:NAME",
      "segmentId": "S2",
      "protectedItemType": "NAME",
      "sourceValue": null,
      "candidateValue": null,
      "status": "NOT_APPLICABLE",
      "reason": null,
      "evidenceRef": null
    },
    {
      "checkId": "S2:CAVEAT",
      "segmentId": "S2",
      "protectedItemType": "CAVEAT",
      "sourceValue": null,
      "candidateValue": null,
      "status": "PRESERVED",
      "reason": null,
      "evidenceRef": null
    },
    {
      "checkId": "S2:UNCERTAINTY",
      "segmentId": "S2",
      "protectedItemType": "UNCERTAINTY",
      "sourceValue": null,
      "candidateValue": null,
      "status": "PRESERVED",
      "reason": null,
      "evidenceRef": null
    },
    {
      "checkId": "S2:COMPARISON:far smaller than",
      "segmentId": "S2",
      "protectedItemType": "COMPARISON",
      "sourceValue": "far smaller than",
      "candidateValue": "far smaller than",
      "status": "PRESERVED",
      "reason": null,
      "evidenceRef": null
    },
    {
      "checkId": "S2:CLASSIFICATION",
      "segmentId": "S2",
      "protectedItemType": "CLASSIFICATION",
      "sourceValue": "FACTUAL",
      "candidateValue": "FACTUAL",
      "status": "PRESERVED",
      "reason": null,
      "evidenceRef": null
    },
    {
      "checkId": "S2:EVIDENCE:C1",
      "segmentId": "S2",
      "protectedItemType": "FACT",
      "sourceValue": "C1",
      "candidateValue": "C1",
      "status": "PRESERVED",
      "reason": null,
      "evidenceRef": "research/research-brief.json#claims.C1"
    },
    {
      "checkId": "S2:EVIDENCE:C6",
      "segmentId": "S2",
      "protectedItemType": "FACT",
      "sourceValue": "C6",
      "candidateValue": "C6",
      "status": "PRESERVED",
      "reason": null,
      "evidenceRef": "research/research-brief.json#claims.C6"
    },
    {
      "checkId": "S3:NUMBER",
      "segmentId": "S3",
      "protectedItemType": "NUMBER",
      "sourceValue": null,
      "candidateValue": null,
      "status": "PRESERVED",
      "reason": null,
      "evidenceRef": null
    },
    {
      "checkId": "S3:DATE",
      "segmentId": "S3",
      "protectedItemType": "DATE",
      "sourceValue": null,
      "candidateValue": null,
      "status": "PRESERVED",
      "reason": null,
      "evidenceRef": null
    },
    {
      "checkId": "S3:QUOTE",
      "segmentId": "S3",
      "protectedItemType": "QUOTE",
      "sourceValue": null,
      "candidateValue": null,
      "status": "PRESERVED",
      "reason": null,
      "evidenceRef": null
    },
    {
      "checkId": "S3:NAME",
      "segmentId": "S3",
      "protectedItemType": "NAME",
      "sourceValue": null,
      "candidateValue": null,
      "status": "NOT_APPLICABLE",
      "reason": null,
      "evidenceRef": null
    },
    {
      "checkId": "S3:CAVEAT",
      "segmentId": "S3",
      "protectedItemType": "CAVEAT",
      "sourceValue": "severalx1",
      "candidateValue": "severalx1",
      "status": "PRESERVED",
      "reason": null,
      "evidenceRef": null
    },
    {
      "checkId": "S3:UNCERTAINTY",
      "segmentId": "S3",
      "protectedItemType": "UNCERTAINTY",
      "sourceValue": null,
      "candidateValue": null,
      "status": "PRESERVED",
      "reason": null,
      "evidenceRef": null
    },
    {
      "checkId": "S3:COMPARISON:more strongly than",
      "segmentId": "S3",
      "protectedItemType": "COMPARISON",
      "sourceValue": "more strongly than",
      "candidateValue": "more strongly than",
      "status": "PRESERVED",
      "reason": null,
      "evidenceRef": null
    },
    {
      "checkId": "S3:CLASSIFICATION",
      "segmentId": "S3",
      "protectedItemType": "CLASSIFICATION",
      "sourceValue": "FACTUAL",
      "candidateValue": "FACTUAL",
      "status": "PRESERVED",
      "reason": null,
      "evidenceRef": null
    },
    {
      "checkId": "S3:EVIDENCE:C1",
      "segmentId": "S3",
      "protectedItemType": "FACT",
      "sourceValue": "C1",
      "candidateValue": "C1",
      "status": "PRESERVED",
      "reason": null,
      "evidenceRef": "research/research-brief.json#claims.C1"
    },
    {
      "checkId": "S3:EVIDENCE:C2",
      "segmentId": "S3",
      "protectedItemType": "FACT",
      "sourceValue": "C2",
      "candidateValue": "C2",
      "status": "PRESERVED",
      "reason": null,
      "evidenceRef": "research/research-brief.json#claims.C2"
    },
    {
      "checkId": "S4:NUMBER",
      "segmentId": "S4",
      "protectedItemType": "NUMBER",
      "sourceValue": null,
      "candidateValue": null,
      "status": "PRESERVED",
      "reason": null,
      "evidenceRef": null
    },
    {
      "checkId": "S4:DATE",
      "segmentId": "S4",
      "protectedItemType": "DATE",
      "sourceValue": null,
      "candidateValue": null,
      "status": "PRESERVED",
      "reason": null,
      "evidenceRef": null
    },
    {
      "checkId": "S4:QUOTE",
      "segmentId": "S4",
      "protectedItemType": "QUOTE",
      "sourceValue": null,
      "candidateValue": null,
      "status": "PRESERVED",
      "reason": null,
      "evidenceRef": null
    },
    {
      "checkId": "S4:NAME",
      "segmentId": "S4",
      "protectedItemType": "NAME",
      "sourceValue": null,
      "candidateValue": null,
      "status": "NOT_APPLICABLE",
      "reason": null,
      "evidenceRef": null
    },
    {
      "checkId": "S4:CAVEAT",
      "segmentId": "S4",
      "protectedItemType": "CAVEAT",
      "sourceValue": null,
      "candidateValue": null,
      "status": "PRESERVED",
      "reason": null,
      "evidenceRef": null
    },
    {
      "checkId": "S4:UNCERTAINTY",
      "segmentId": "S4",
      "protectedItemType": "UNCERTAINTY",
      "sourceValue": null,
      "candidateValue": null,
      "status": "PRESERVED",
      "reason": null,
      "evidenceRef": null
    },
    {
      "checkId": "S4:CLASSIFICATION",
      "segmentId": "S4",
      "protectedItemType": "CLASSIFICATION",
      "sourceValue": "FACTUAL",
      "candidateValue": "FACTUAL",
      "status": "PRESERVED",
      "reason": null,
      "evidenceRef": null
    },
    {
      "checkId": "S4:EVIDENCE:C1",
      "segmentId": "S4",
      "protectedItemType": "FACT",
      "sourceValue": "C1",
      "candidateValue": "C1",
      "status": "PRESERVED",
      "reason": null,
      "evidenceRef": "research/research-brief.json#claims.C1"
    },
    {
      "checkId": "S5:NUMBER",
      "segmentId": "S5",
      "protectedItemType": "NUMBER",
      "sourceValue": null,
      "candidateValue": null,
      "status": "PRESERVED",
      "reason": null,
      "evidenceRef": null
    },
    {
      "checkId": "S5:DATE",
      "segmentId": "S5",
      "protectedItemType": "DATE",
      "sourceValue": null,
      "candidateValue": null,
      "status": "PRESERVED",
      "reason": null,
      "evidenceRef": null
    },
    {
      "checkId": "S5:QUOTE",
      "segmentId": "S5",
      "protectedItemType": "QUOTE",